Headline,Slug,Collection ID,Locale ID,Item ID,Archived,Draft,Created On,Updated On,Published On,Publishing Date,Tagline,Image,Content,Color,Image Style
Riddle&Code is taking the next step towards Web3 product focus and the launch of the RDDL Network with the announcement of new CEO John Calian,riddle-code-is-taking-the-next-step-towards-web3-product-focus-and-the-launch-of-the-rddl-network-with-the-announcement-of-new-ceo-john-calian,651eafbae761a2b4e1c54bd5,651eafbbe761a2b4e1c55101,651eafbae761a2b4e1c54c8c,false,true,Tue Mar 14 2023 10:08:45 GMT+0000 (Coordinated Universal Time),Thu Feb 13 2025 10:12:38 GMT+0000 (Coordinated Universal Time),,Tue Aug 23 2022 08:15:00 GMT+0000 (Coordinated Universal Time),R&C is pleased to announce a new CEO,https://uploads-ssl.webflow.com/63f3a24533e09e09d583beeb/66003cf1c5ce9c8f1929b724_Calian%202020%20_MB.jpeg,"<p id=""""><strong id="""">Vienna, Austria, 23rd August, </strong>Riddle&amp;Code GmbH is pleased to&nbsp;announce John Calian as the new CEO of the company.&nbsp;&nbsp;</p><p id="""">""I am grateful to have been selected as Riddle&amp;Code's next CEO. We are&nbsp; an organisation led by a purpose – to onboard industrial machines to&nbsp; Web3. It is a privilege to lead a team dedicated to machine-driven token&nbsp; economies, enabling sustainable, green, resilient energy systems,"" said&nbsp; Calian. ""That is the mission of our company. I will do my best to serve the&nbsp; team and our customers by enabling our leaders and people to do their&nbsp; best work.""&nbsp;</p><p id="""">This decision comes at a momentous time, as Riddle&amp;Code evolves into a&nbsp; product-led service company specialising in Web3 infrastructure and&nbsp; establishing the unique RDDL Network blockchain, which provides the&nbsp; cornerstones for decentralised, secure, and trusted machine economies.&nbsp; Riddle&amp;Code is preparing to be a key contributor to this network and aims&nbsp; to provide the best products, services, and solutions to make this vision&nbsp; flourish.&nbsp;</p><p id="""">Working with enterprise partners such as Wien Energie, Daimler Mobility,&nbsp;Evonik, Litebit, and Telekom Innovation Laboratories (T-Labs),&nbsp; Riddle&amp;Code has built an extensive portfolio of blockchain-powered&nbsp; software and hardware products across key industry segments, highlighted&nbsp; by renewable energy producers, electric vehicle manufacturers and large&nbsp; scale energy storage systems providers.&nbsp;&nbsp;</p><p id="""">""We are at a natural turning point for the company, and John brings the&nbsp; leadership and expertise needed for Riddle&amp;Code to enter this next phase.&nbsp; Our new purpose is to share our established knowledge and onboard as&nbsp;many industries as possible to Web3 to shape the future of interconnecting&nbsp; token economies with the RDDL Network. This goes way beyond the&nbsp; wildest ambitions of current token projects and energy tech companies."" ~&nbsp; Tom Fürstner, Founder and CTO of Riddle&amp;Code.&nbsp;</p><p id="""">The landscape for decentralised infrastructure is rapidly changing, and&nbsp; there has been an increase in demand for blockchain-based software&nbsp; systems due to the ongoing shift towards Web3. This new era requires&nbsp; industries to set up new operating and business models, combining old&nbsp; strengths with a new way of thinking.&nbsp;</p><p id="""">Riddle&amp;Code is now focused on being a key player in onboarding&nbsp; industries to Web3 and will provide specific products and services. Co Founder and outgoing CEO Alexander Koppel will continue as Advisor to&nbsp; the CEO in the future and further support the company's mission. This&nbsp; announcement is the logical next step in the further evolution and&nbsp; continued progress of Riddle&amp;Code and its subsidiary companies.&nbsp;</p><p id=""""><strong id="""">About Riddle&amp;Code&nbsp;&nbsp;</strong></p><p id="""">Riddle&amp;Code is a product-led services company specialising in onboarding industries to Web3.&nbsp; The company is the main driver for a world of interconnected token economies by enabling&nbsp; sustainable, green, and resilient machine industries. Riddle&amp;Code offers various solutions to&nbsp; tailor industry-specific hardware wallets and an application suite to build on decentralised&nbsp; blockchains, mainly contributing to the RDDL Network blockchain protocol.&nbsp;</p><p id=""""><strong id="""">About the RDDL Network&nbsp;&nbsp;</strong></p><p id="""">The RDDL Network is a decentralised, industrial machine-powered blockchain protocol that&nbsp; uses a unique Proof-of Productivity (PoP) consensus mechanism that proves identity, data&nbsp; accuracy, and usage for all types of machines. It addresses infrastructure and standards as a&nbsp; whole and is designed to shape the future of interconnected token economies for the fourth&nbsp; industrial revolution.</p><p id="""">‍</p><p id="""">Read the whole press release here:</p><p id=""""><a href=""https://drive.google.com/file/d/113G4kzz70sOsV7zitQnFRW09G_ZnRM0x/view"" target=""_blank"" id="""">ENGLISH</a></p><p id=""""><a href=""https://drive.google.com/file/d/19blrJIuoMOUkwlTvlYajJc45Kk1V_eMp/view"" target=""_blank"">GERMAN</a></p>","hsla(197.5531914893617, 97.92%, 62.35%, 1.00)",half-width
Riddle&Code is attending Web Summit in Lisbon,riddle-code-is-attending-web-summit-in-lisbon,651eafbae761a2b4e1c54bd5,651eafbbe761a2b4e1c55101,651eafbae761a2b4e1c54c8d,false,false,Fri Mar 17 2023 04:43:58 GMT+0000 (Coordinated Universal Time),Fri Mar 17 2023 15:56:22 GMT+0000 (Coordinated Universal Time),Wed Aug 21 2024 12:48:56 GMT+0000 (Coordinated Universal Time),Wed Oct 12 2022 15:00:00 GMT+0000 (Coordinated Universal Time),R&C meets Web Summit,https://uploads-ssl.webflow.com/63f3a24533e09e09d583beeb/6413f00b2d930698cdfa5299_r%26c_3.jpg,"<p id="""">Riddle&amp;Code’s professionals will attend this year’s Web Summit, which takes place in Altice Arena &amp; Fil Lisbon between <strong id="""">November 1-4</strong>, 2022.</p><p id="""">Web Summit has become “Europe’s largest and most important technology marketplace”. It is an unrivalled global meeting place for the world’s most disruptive technology companies and those interested in how that disruption can transform their businesses and lives.</p><p id="""">From Riddle&amp;Code’s side, you will have the opportunity to meet <strong id="""">John Calian</strong> (CEO), <strong id="""">Tom Fürstner</strong> (Founder &amp; CTO), <strong id="""">Christiane Rinke</strong> (Head of Marketing), <strong id="""">Gianluca Graf </strong>(Head of Sales), <strong id="""">Dietmar Kofler</strong> (Head of Product &amp; Community), <strong id="""">Gregory Stephen</strong> (Program Manager) and <strong id="""">Kai Siefert</strong> (Managing Director of Riddle&amp;Code Energy Solutions).</p><p id="""">We invite you to join us in Lisbon! Register right <a href=""https://websummit.com/tickets/attendees"" target=""_blank"" id="""">HERE</a>.</p>",,
Riddle&Code ignites the fourth industrial revolution by onboarding machines onto Web3!,riddle-code-ignites-the-fourth-industrial-revolution-by-onboarding-machines-onto-web3,651eafbae761a2b4e1c54bd5,651eafbbe761a2b4e1c55101,651eafbae761a2b4e1c54c8e,false,false,Fri Mar 17 2023 04:47:43 GMT+0000 (Coordinated Universal Time),Fri Mar 17 2023 18:55:47 GMT+0000 (Coordinated Universal Time),Wed Aug 21 2024 12:48:56 GMT+0000 (Coordinated Universal Time),Wed Nov 02 2022 09:00:00 GMT+0000 (Coordinated Universal Time),R&C meets 4th Industrial Revolution,https://uploads-ssl.webflow.com/63f3a24533e09e09d583beeb/6413f0da1251e37b735acc0b_r%26c_2.jpg,"<p id="""">‍<strong id="""">Vienna, Austria, November 2, </strong>Riddle&amp;Code, one of Austria’s fastest growing startups, has established a new path of digitalization for industrial companies with its evolved purpose -onboarding industries to Web3. For many industrial companies it is challenging to transition into the new standards and find their way in the Web3 universe, often delaying entry into new potential business models. With this new technology from Riddle&amp;Code, it is possible to tokenize industrial machines, create new crowdfunding opportunities, and provide trusted data. </p><p id="""">To meet this ambitious purpose, the company has now launched programs to help enterprises and trailblazing developers alike capitalize on their own innovation. Called <a href=""https://www.riddleandcode.com/enterprise"" target=""_blank"" id="""">HW-03 Enterprise</a> and <a href=""https://www.riddleandcode.com/community"" target=""_blank"" id="""">HW-03 Community</a>, the two programs from Riddle&amp;Code focus on hardware wallet adoption that will accelerate not only Web3 knowledge but also create new business opportunities for a sustainable future.</p><p id=""""><strong id="""">Not every blockchain is suitable </strong></p><p id="""">Since its incorporation in 2016, Riddle&amp;Code has been developing blockchain solutions for various industrial sectors, mainly energy production and electric vehicle manufacturing. Working with such companies as Wien Energie, Deutsche Telekom and Daimler Mobility, the team at Riddle&amp;Code knows that not every blockchain has the necessary features to meet the specific needs of each industry. In order to push its clients into the fourth industrial age, Riddle&amp;Code has enabled the launch of the RDDL Network, a blockchain based protocol tailor made for security, scalability and decentralisation in the energy systems sector. The HW-03 programs are built around usage of the RDDL Network, and require a physical connection via hardware wallets.</p><p id="""">“The long experience in the field of cryptographic encryption on special hardware has inspired us to find a suitable solution for the industrial sector” says Riddle&amp;Code’s founder Tom Fürstner, who recently released the <a href=""http://www.rddl.io"" id="""">whitepaper of the RDDL Network</a>.</p><p id="""">The RDDL Network utilizes a unique consensus mechanism called “Proof-of-Productivity”, which makes machines tamper-proof and enables a new kind of trust and traceability for the generated machine data. With a cryptographic hardware wallet connected to a machine, the machine turns into a decentralised identifier on the network – an Industrial Machine NFT. Therefore, the machine itself becomes a part of the network. In the upcoming years, Riddle&amp;Code anticipates over 50 million machines operating as nodes on the RDDL Network, powering the energy sector of the future.&nbsp;</p><p id=""""><strong id="""">About Riddle&amp;Code </strong></p><p id="""">Riddle&amp;Code is a product-led services company specialising in onboarding industries to Web3. The company is the main driver for a world of interconnected token economies by enabling sustainable, green, and resilient machine industries. Riddle&amp;Code offers various solutions to tailor industry-specific hardware wallets and Software-as-a-Service Products to build on decentralised blockchains, mainly contributing to the RDDL Network blockchain protocol.</p><p id=""""><strong id="""">More information:</strong> <a href=""http://www.riddleandcode.com"" id="""">www.riddleandcode.com</a> / <a href=""http://www.rddl.io"" id="""">www.rddl.io</a> &nbsp; &nbsp; &nbsp; &nbsp; &nbsp; &nbsp;</p><p id=""""><strong id="""">Media contact:</strong> <a href=""http://christiane.rinke@riddleandcode.com"" id="""">Christiane Rinke </a></p><p id=""""><a href=""https://drive.google.com/file/d/1IWU0xfMJ9R71KiDwZ8Dw6O1X9_Z_diZf/view"" target=""_blank"" id="""">DOWNLOAD&nbsp;THE&nbsp;WHOLE&nbsp;PRESS&nbsp;RELEASE</a></p><p>‍</p>","hsla(123.85714285714283, 74.47%, 63.14%, 1.00)",half-width
Riddle&Code introduces the HW-03 Community Program for Developers,riddle-code-introduces-the-hw-03-community-program-for-developers,651eafbae761a2b4e1c54bd5,651eafbbe761a2b4e1c55101,651eafbae761a2b4e1c54c8f,false,false,Fri Mar 17 2023 04:50:01 GMT+0000 (Coordinated Universal Time),Fri Mar 17 2023 04:50:01 GMT+0000 (Coordinated Universal Time),Wed Aug 21 2024 12:48:56 GMT+0000 (Coordinated Universal Time),Wed Dec 07 2022 09:00:00 GMT+0000 (Coordinated Universal Time),Every Piece of Code Tells a Story,https://uploads-ssl.webflow.com/63f3a24533e09e09d583beeb/6413f1692d9306f4d0fa6a8d_r%26c_comunity_program_divider.jpg,"<p id=""""><strong id="""">Vienna, Austria, 7th December, </strong>Riddle&amp;Code is officially launching the Hardware Wallet (HW-03) Community Program for developers to build innovative, sustainable solutions for Industry 4.0 and Web3.&nbsp;</p><p id="""">""Today marks a new starting point for Riddle&amp;Code,"" said Dietmar Kofler, Head of Community at Riddle&amp;Code. ""After years of experience working on the interface of humans and machines with the corporate world, I'm very excited to share our learnings with like-minded people in the open-source community. The program is designed to empower developers to build on the upcoming RDDL network with as little effort as possible.""</p><p id="""">For Riddle&amp;Code, the future is rooted in machine economies and sustainable Web3. Their goal is to give everyone access to the necessary tools to build innovations and enable a smooth transition into a more decentralized, distributed and transparent future.&nbsp;</p><p id="""">Bringing Hardware from Web0 to Web3 is the new HW-03 Community Program idea. It provides multiple software tools and a cryptographic hardware wallet, which can be attached to any kind of machine, making it highly interesting for Developers and Students in the IT industry.&nbsp;</p><p id="""">The program allows members to turn any device into a trusted data source and a wallet. Meaning to secure the machine and its data at the source. It is possible to secure connections to public or private clouds, edge computing platforms and own infrastructures. Further IoT-connected devices can be equipped with dedicated hardware wallets following a BIP39&nbsp;backup scheme. The also included Sonoff Power Meter enables active interaction with home devices.</p><p id="""">In an Early Adopter Program, Riddle&amp;Code is handing out a HW-03 Community Kit free of charge for interested parties. The HW-03 Community Kit is a powerful combination of a Hardware Wallet, a Data Logger and a Smart Energy Meter. It is the foundation to attest machine identities and their data signals to distributed ledgers.</p><p id="""">The Launch of the Community Program is just one part of Riddle&amp;Code's HW-03 Community Program Roadmap for 2023, including Hackathons, Conferences and several Webinars.</p><p id=""""><strong>About Riddle&amp;Code</strong></p><p id="""">Riddle&amp;Code is a product-led services company specializing in onboarding industries to Web3. The company is the main driver for a world of interconnected token economies by enabling sustainable, green, and resilient machine industries. Riddle&amp;Code offers industry-specific hardware wallet solutions and software tools to build upon decentralized blockchains, mainly contributing to the RDDL Network blockchain protocol.</p><p id=""""><strong>About the RDDL Network</strong></p><p id="""">The RDDL Network is a decentralized, industrial machine-powered blockchain protocol that uses a unique Proof-of Productivity (PoP) consensus mechanism that proves identity, data accuracy, and usage for all types of machines. It addresses infrastructure and standards as a whole and is designed to shape the future of interconnected token economies for the fourth industrial revolution.</p><p id=""""><strong id="""">More information: </strong><a href=""https://www.riddleandcode.com/community"" id="""">https://www.riddleandcode.com/community</a><strong id=""""> </strong></p><p id=""""><strong id="""">Media contact:</strong> <a href=""mailto:http://christiane.rinke@riddleandcode.com"" id="""">Christiane Rinke</a>&nbsp;</p><p>‍</p>",,
Revolutionizing Business Models with a Blockchain for Machines: Solving the Oracle Problem with Smart Hardware Wallets and Tokenization,revolutionizing-business-models-with-a-blockchain-for-machines,651eafbae761a2b4e1c54bd5,651eafbbe761a2b4e1c55101,651eafbae761a2b4e1c54d64,false,false,Tue Apr 04 2023 14:00:41 GMT+0000 (Coordinated Universal Time),Tue Apr 04 2023 14:39:28 GMT+0000 (Coordinated Universal Time),Wed Aug 21 2024 12:48:56 GMT+0000 (Coordinated Universal Time),Mon Apr 03 2023 13:51:00 GMT+0000 (Coordinated Universal Time),R&C brings traditional machines to Web3 ,https://uploads-ssl.webflow.com/63f3a24533e09e09d583beeb/642c2b6c6585b9f96bfe17ab_Visuals%20for%20social%20media%20-5.jpg,"<p id="""">‍</p><p id="""">Riddle&amp;Code is using the <a href=""https://www.rddl.io"" id="""">RDDL Foundation</a>'s invention, the decentralized trust anchor, to integrate traditional machines with blockchain technology. This innovative approach combines hardware and software, enabling data outputs to be tokenized and creating new business models in various industries, including energy, supply chain and tech.</p><p id="""">The Trust Anchor can log and cryptographically convert energy output into tokens in real-time, enabling micro-investments and providing data on green energy sources and materials. This breakthrough technology has the potential to revolutionize global infrastructure by allowing individuals and businesses to transact in new markets, accurately track green practices, and benefit tangibly from tokenized incentives.<br><br>With Riddle&amp;Code's cutting-edge solution, industries can easily bring their machines onto Web3 and take advantage of the endless possibilities that blockchain technology offers.</p><p id="""">Riddle&amp;Code was founded six years ago with the mission of bringing the blockchain's efficiency in managing digital assets to the physical world. The idea, says founder and CTO Thomas Fürstner, was <em id="""">""if we cannot bring physical assets to the blockchain, let's bring blockchain to physical assets.""</em><br><br>Read the whole interview with Thomas Fürstner, CTO&nbsp;&amp;&nbsp;Founder of Riddle&amp;Code on <a href=""https://www.blockdata.tech/blog/spotlight/solving-the-oracle-problem-with-smart-hardware-wallets-and-tokenization"" id="""">Blockdata website</a>, to understand the difference between centralized and decentralized structure, the advantages of a decentralized trust anchor, how it can help revolutionize the energy industry and what lies ahead. </p><p id="""">‍</p>",,
